{
  "$schema": "suite.schema.json",
  "schema_version": 1,
  "suite_id": "skivolve-software-engineering-v1",
  "seed": 20260710,
  "repository_root": ".",
  "evaluation_mode": "judged",
  "provider": {
    "adapter": "claude-cli",
    "executable": "claude",
    "model": "claude-haiku-4-5-20251001",
    "max_budget_usd": 1.5,
    "timeout_seconds": 300
  },
  "comparator": {
    "adapter": "claude-cli",
    "executable": "claude",
    "model": "claude-sonnet-5",
    "max_budget_usd": 1.0,
    "timeout_seconds": 300
  },
  "comparator_profile": {
    "kind": "builtin",
    "id": "software-engineering-v1"
  },
  "shared_verifier_dir": "cases/testing/_shared",
  "variants": [
    {
      "id": "no-skill",
      "kind": "without_skill"
    },
    {
      "id": "original",
      "kind": "git_ref",
      "git_ref": "21db6fdad124c2b0769dee6466a23ebddc0264bd"
    },
    {
      "id": "candidate",
      "kind": "worktree",
      "root": ".",
      "source_ref": "HEAD"
    }
  ],
  "comparisons": [
    {
      "id": "original-vs-no-skill",
      "control": "no-skill",
      "treatment": "original",
      "repetitions": 3,
      "comparator_order": "ab_ba"
    },
    {
      "id": "candidate-vs-original",
      "control": "original",
      "treatment": "candidate",
      "repetitions": 3,
      "comparator_order": "ab_ba"
    },
    {
      "id": "candidate-vs-no-skill",
      "control": "no-skill",
      "treatment": "candidate",
      "repetitions": 3,
      "comparator_order": "ab_ba"
    }
  ],
  "holdout": {
    "comparison_ids": [
      "candidate-vs-original",
      "candidate-vs-no-skill"
    ]
  },
  "cases": [
    {
      "id": "software-minimal-slug-limit",
      "skill": "engineering",
      "bundle_source": "skills/engineering",
      "artifact_contract": {
        "kind": "workspace_diff"
      },
      "split": "train",
      "prompt_file": "cases/software/minimal-slug-limit/prompt.md",
      "fixture_dir": "cases/software/minimal-slug-limit/fixture",
      "verifier": {
        "argv": [
          "python3",
          "cases/software/minimal-slug-limit/oracle/verify.py"
        ],
        "required_tools": [],
        "timeout_seconds": 10
      },
      "context_files": [
        "skills/engineering/SKILL.md"
      ],
      "timeout_seconds": 300,
      "critical_expectations": [
        "slug-limit-behavior",
        "legacy-slug-behavior",
        "minimal-production-scope",
        "public-call-contract"
      ],
      "comparator_contract": {
        "requirements": [
          {
            "id": "slug-limit-behavior",
            "kind": "required_behavior",
            "text": "With a positive max_length, make_slug must return a normalized slug no longer than the limit, never ending in '-', retain the longest complete hyphen-separated prefix when one fits, truncate an overlong first word, return '' for input with no slug characters, and reject zero or negative limits."
          },
          {
            "id": "legacy-slug-behavior",
            "kind": "required_behavior",
            "text": "Omitting max_length must preserve the original one-argument signature behavior and exact normalized output for all legacy inputs."
          },
          {
            "id": "minimal-production-scope",
            "kind": "required_behavior",
            "text": "The production change must remain in slugger.py; no production-reachable helper, dependency manifest, third-party import, or unrelated file may be added."
          },
          {
            "id": "public-call-contract",
            "kind": "hard_constraint",
            "text": "make_slug must keep the original text positional parameter and add max_length as an optional parameter with default None, so both positional and keyword calls remain compatible."
          }
        ],
        "performance_basis": null,
        "qualitative_bases": {}
      }
    },
    {
      "id": "software-symbol-verification",
      "skill": "engineering",
      "bundle_source": "skills/engineering",
      "artifact_contract": {
        "kind": "workspace_diff"
      },
      "split": "train",
      "prompt_file": "cases/software/symbol-verification/prompt.md",
      "fixture_dir": "cases/software/symbol-verification/fixture",
      "verifier": {
        "argv": [
          "python3",
          "cases/software/symbol-verification/oracle/verify.py"
        ],
        "required_tools": [
          "node"
        ],
        "timeout_seconds": 10
      },
      "context_files": [
        "skills/engineering/SKILL.md"
      ],
      "timeout_seconds": 300,
      "critical_expectations": [
        "cached-token-behavior",
        "local-api-contract",
        "no-runtime-dependency"
      ],
      "comparator_contract": {
        "requirements": [
          {
            "id": "cached-token-behavior",
            "kind": "required_behavior",
            "text": "getCachedAuthorization(cacheFile, nowEpochMs) must return 'Bearer <token>' for a fresh valid record, null for an expired or missing record, and propagate malformed-record errors."
          },
          {
            "id": "local-api-contract",
            "kind": "required_behavior",
            "text": "session.js must call the existing readFreshToken API; token-store.js must remain byte-for-byte unchanged and continue to export exactly readFreshToken."
          },
          {
            "id": "no-runtime-dependency",
            "kind": "hard_constraint",
            "text": "The change must add no dependency declaration, lockfile, node_modules tree, or non-relative/non-node runtime import."
          }
        ],
        "performance_basis": null,
        "qualitative_bases": {}
      }
    },
    {
      "id": "software-secure-archive-restore",
      "skill": "engineering",
      "bundle_source": "skills/engineering",
      "artifact_contract": {
        "kind": "workspace_diff"
      },
      "split": "train",
      "prompt_file": "cases/software/secure-archive-restore/prompt.md",
      "fixture_dir": "cases/software/secure-archive-restore/fixture",
      "verifier": {
        "argv": [
          "python3",
          "cases/software/secure-archive-restore/oracle/verify.py"
        ],
        "required_tools": [],
        "timeout_seconds": 365
      },
      "context_files": [
        "skills/engineering/SKILL.md"
      ],
      "timeout_seconds": 300,
      "critical_expectations": [
        "valid-archive-behavior",
        "standard-library-only",
        "path-containment",
        "unsupported-member-types",
        "duplicate-member-defense",
        "declared-resource-limits",
        "bounded-entry-consumption",
        "invalid-archive-atomicity",
        "existing-destination-preserved",
        "publication-failure-atomicity",
        "public-call-contract"
      ],
      "comparator_contract": {
        "requirements": [
          {
            "id": "valid-archive-behavior",
            "kind": "required_behavior",
            "text": "For a valid tar containing directories and regular files, including inputs exactly at every declared limit, restore_project must reproduce exact file bytes and empty directories under a new destination and return sorted POSIX-style relative paths for regular files only."
          },
          {
            "id": "standard-library-only",
            "kind": "hard_constraint",
            "text": "The implementation must use only Python standard-library and local project code, without a dependency declaration, vendored package, or external runtime import."
          },
          {
            "id": "path-containment",
            "kind": "hard_constraint",
            "text": "Absolute member names and names containing a parent component must raise an exception without creating the destination, writing an escaped path, or leaving other filesystem residue."
          },
          {
            "id": "unsupported-member-types",
            "kind": "hard_constraint",
            "text": "Symlinks, hard links, FIFOs, devices, and every member type other than a directory or regular file must raise an exception without publishing output or leaving residue."
          },
          {
            "id": "duplicate-member-defense",
            "kind": "hard_constraint",
            "text": "Duplicate output paths and file/directory shape conflicts must raise an exception without publishing output or leaving residue."
          },
          {
            "id": "declared-resource-limits",
            "kind": "hard_constraint",
            "text": "The implementation must reject a 129th member, reject any regular file whose declared size exceeds 1 MiB before reading its content, and reject before reading a member whose declared size would make total regular-file content exceed 4 MiB, while accepting values exactly at each limit."
          },
          {
            "id": "bounded-entry-consumption",
            "kind": "hard_constraint",
            "text": "Entry-count rejection must occur once the 129th member is observed without scanning or consuming the remaining attacker-controlled archive tail."
          },
          {
            "id": "invalid-archive-atomicity",
            "kind": "hard_constraint",
            "text": "A late policy violation, malformed archive, truncated payload, read failure, or write failure must raise an exception while leaving an absent destination absent and leaving no staging or escaped filesystem residue."
          },
          {
            "id": "existing-destination-preserved",
            "kind": "hard_constraint",
            "text": "If any filesystem entry already exists at the destination, restore_project must raise an exception and preserve every existing path, byte, type, and mode exactly."
          },
          {
            "id": "publication-failure-atomicity",
            "kind": "hard_constraint",